{
  "$schema": "https://json-schema.org/draft/2020-12/schema",
  "title": "hoshi CLI response",
  "type": "object",
  "required": ["schema_version", "ok"],
  "additionalProperties": true,
  "properties": {
    "schema_version": { "const": 2, "description": "CLI JSON schema version. Bump on breaking changes." },
    "ok": { "type": "boolean" },
    "message": { "type": "string" },
    "now": { "type": "integer", "minimum": 0 },
    "deterministic": { "type": "boolean" },
    "save_schema": { "type": "integer" },
    "resources": {
      "type": "object",
      "required": ["iron", "silicon", "rare_earths", "water_ice", "helium_3", "deuterium"],
      "properties": {
        "iron": { "type": "number" },
        "silicon": { "type": "number" },
        "rare_earths": { "type": "number" },
        "water_ice": { "type": "number" },
        "helium_3": { "type": "number" },
        "deuterium": { "type": "number" }
      }
    },
    "rates": { "type": "object" },
    "energy": {
      "type": "object",
      "description": "Home energy produced, consumed and the resulting factor, alongside resources.",
      "required": ["produced", "consumed", "factor"],
      "properties": {
        "produced": { "type": "number" },
        "consumed": { "type": "number" },
        "factor": { "type": "number" }
      }
    },
    "heat": {
      "type": "object",
      "description": "Home heat load versus radiator sink, alongside resources.",
      "required": ["load", "sink"],
      "properties": {
        "load": { "type": "number" },
        "sink": { "type": "number" }
      }
    },
    "waste": {
      "type": "object",
      "description": "Instantaneous heat and pollution load versus sink, plus unrest and the warning flag."
    },
    "buildings": { "type": "object" },
    "build_queue": { "type": "array" },
    "research": { "type": "object" },
    "fleet": { "type": "object" },
    "defences": {
      "type": "object",
      "description": "Home planet defence counts and dome/station levels."
    },
    "missions": { "type": "array" },
    "spy_reports": {
      "type": "array",
      "description": "Arrived spy reports with source, observed_at, age_secs and confidence. Each outpost also carries its latest arrived report. Pending reports are omitted."
    },
    "facts": {
      "type": "array",
      "description": "Remote intel facts from `hoshi intel`. Each fact keeps every arrived observation for one object field."
    },
    "baseline": {
      "type": "object",
      "description": "Public outcome snapshot of live state from `hoshi scenario compare` (resources, KPIs, risk, aged intel)."
    },
    "scenario": {
      "type": "object",
      "description": "Public outcome snapshot of the sandbox from `hoshi scenario compare`. Hidden simulation is omitted."
    },
    "observations": {
      "type": "array",
      "description": "Provenance chain from `hoshi intel provenance`. Source, time, age, confidence and the player-visible value; never hidden truth."
    },
    "planets": { "type": "array" },
    "events": { "type": "array" },
    "snapshot": {
      "type": ["object", "null"],
      "description": "Recorded empire glance for `hoshi log --at`. Null when the time is outside the retained window."
    },
    "exported": {
      "type": ["string", "null"],
      "description": "Path written by `hoshi log --export` as JSON lines."
    },
    "raid": {
      "type": ["object", "null"],
      "description": "Visible raid countdown, matching the TUI overview."
    },
    "prestige": {
      "type": "object",
      "description": "Meta currency, current run and owned bonuses."
    },
    "achievements": {
      "type": "array",
      "description": "Unlocked achievements with unix timestamps. Hidden locked rows are omitted."
    },
    "daily": {
      "type": "object",
      "description": "In-game daily goals for the current day: streak, time until reset, and slot progress."
    },
    "victory": {
      "type": "object",
      "description": "Galaxy victory progress: pirate homeworld, the three paths, and the recorded win if any."
    },
    "ladder": {
      "type": "object",
      "description": "Industrial goal ladder: current completed tier, next goal progress from sustained rates, and completed ids."
    },
    "frontier": {
      "type": "object",
      "description": "Frontier galaxy unlock: revealed sector count, research/wonder/bridge flags, and visible worlds with bonuses."
    },
    "season": {
      "type": ["object", "null"],
      "description": "Seasonal galaxy overlay when this save is a seasonal run: rule-set id, window, seed and whether prestige is shared."
    },
    "species": {
      "type": ["object", "null"],
      "description": "Playable species overlay when this save chose an empire: id, name, brew timer and optional flagship."
    },
    "rivals": {
      "type": "object",
      "description": "NPC rival empires for this galaxy: enabled flag and an intel list gated by espionage (id, personality, home, last action, optional stockpile/fleet/buildings)."
    },
    "finance": {
      "type": "object",
      "description": "Treasury cash, debt (negative cash), and the number of held over-budget spends waiting for approval."
    },
    "kpis": {
      "type": "object",
      "description": "KPI board: next report time, number of targets, and number of archived period reports."
    },
    "incidents": {
      "type": "array",
      "description": "Classification leak incidents visible to the actor."
    },
    "incident_board": {
      "type": "object",
      "description": "Operational incident board: open count, risk register size, and archived post-incident reviews."
    },
    "maintenance": {
      "type": "object",
      "description": "Asset board: counts of assets, open work orders and retained telemetry readings."
    },
    "tutorial": {
      "type": "object",
      "description": "Onboarding hint progress: whether the tutorial is enabled, skipped, and which hint is pending."
    },
    "moons": {
      "type": "array",
      "description": "Orbital moons of owned planets, with phalanx and jump-gate levels."
    },
    "tactics": {
      "type": "object",
      "description": "Home fleet formation, stance, auto-retreat threshold and admiral."
    },
    "laws": {
      "type": "array",
      "description": "Proposed, enacted and repealed laws with approvals and latest expected vs measured samples."
    },
    "leaders": {
      "type": "array",
      "description": "Leaders with traits, assignment, retirement and delegations."
    },
    "vehicles": {
      "type": "array",
      "description": "Named vehicles for orbital mission planning."
    },
    "planned": {
      "type": "array",
      "description": "In-flight PlanMission rows with transfer, customer, delta-v and arrival."
    },
    "windows": {
      "type": "array",
      "description": "Synodic launch windows from `mission windows` (`open`, `upcoming`, or `missed`)."
    },
    "alerts": {
      "type": "array",
      "description": "Schedule alerts: double-booked vehicles or missed launch windows."
    },
    "delta_v": {
      "type": "number",
      "description": "Transfer delta-v in metres per second, including gravity wells."
    },
    "coast_secs": {
      "type": "integer",
      "description": "Compressed coast time for the planned transfer."
    },
    "scoring_version": {
      "type": "integer",
      "description": "Arena scoring formula version. See docs/arena.md."
    },
    "bots": {
      "type": "array",
      "description": "Arena bot results for one run."
    },
    "markdown": {
      "type": "string",
      "description": "Arena leaderboard table for sharing."
    },
    "error": {
      "type": "object",
      "required": ["code", "message"],
      "properties": {
        "code": { "enum": ["invalid", "refused", "locked", "internal"] },
        "message": { "type": "string" }
      }
    }
  }
}
